[
  {
    "key": "construction.closure.direction",
    "label_vi": "Hướng khép vạt",
    "description": "Hướng của vạt áo khi khép: phải đè trái (hữu nhậm) hoặc trái đè phải.",
    "value_type": "enum",
    "cardinality": "single",
    "allowed_values": ["right_over_left", "left_over_right"],
    "applies_to": ["garment", "garment_variant"],
    "contextual": true,
    "queryable": true,
    "inheritable": true,
    "default_missing_state": "not_collected",
    "status": "draft",
    "version": 1
  },
  {
    "key": "construction.body_panels",
    "label_vi": "Số thân áo",
    "description": "Số lượng thân vải tạo nên thân áo chính.",
    "value_type": "number",
    "cardinality": "single",
    "allowed_values": null,
    "applies_to": ["garment", "garment_variant"],
    "contextual": false,
    "queryable": true,
    "inheritable": true,
    "default_missing_state": "not_collected",
    "status": "draft",
    "version": 1
  },
  {
    "key": "construction.sleeve.shape",
    "label_vi": "Kiểu tay áo",
    "description": "Hình dáng tay áo: tay chẽn (hẹp), tay thụng (rộng), v.v.",
    "value_type": "enum",
    "cardinality": "single",
    "allowed_values": ["tay_chen", "tay_thung", "tay_raglan"],
    "applies_to": ["garment", "garment_variant"],
    "contextual": true,
    "queryable": true,
    "inheritable": true,
    "default_missing_state": "not_collected",
    "status": "draft",
    "version": 1
  },
  {
    "key": "material.primary",
    "label_vi": "Chất liệu chính",
    "description": "Chất liệu vải chính dùng may trang phục.",
    "value_type": "entity_ref",
    "cardinality": "single",
    "allowed_values": null,
    "applies_to": ["garment", "garment_variant", "accessory"],
    "contextual": true,
    "queryable": true,
    "inheritable": true,
    "default_missing_state": "not_collected",
    "status": "draft",
    "version": 1
  },
  {
    "key": "visual.collar.style",
    "label_vi": "Kiểu cổ áo",
    "description": "Kiểu dáng cổ áo: cổ đứng, cổ tròn, cổ giao lĩnh, v.v.",
    "value_type": "enum",
    "cardinality": "single",
    "allowed_values": ["co_dung", "co_tron", "co_giao_linh", "co_tay"],
    "applies_to": ["garment", "garment_variant"],
    "contextual": true,
    "queryable": true,
    "inheritable": true,
    "default_missing_state": "not_collected",
    "status": "draft",
    "version": 1
  }
]
